[
  {
    "id": "news-2026-06-07-001",
    "title": "Bitcoin reclaims $68k as ETF inflows resume",
    "url": "https://www.coindesk.com/markets/2026/06/07/btc-68k",
    "source": "coindesk",
    "source_type": "rss",
    "published_at": "2026-06-07T11:45:00.000Z",
    "entities": ["crypto:btc-usdt", "BTC"],
    "summary": "Spot ETF net inflows turned positive for the week, coinciding with a reclaim of the $68,000 level.",
    "relevance_score": 0.82,
    "sentiment": "positive",
    "tags": ["etf", "flows", "btc"]
  },
  {
    "id": "news-2026-06-07-002",
    "title": "Whale moves 12,000 ETH to exchange",
    "url": "https://twitter.com/whale_alert/status/1234567890",
    "source": "@whale_alert",
    "source_type": "social",
    "published_at": "2026-06-07T10:20:00.000Z",
    "entities": ["crypto:eth-usdt", "ETH"],
    "summary": "An address tagged as a long-term holder transferred 12,000 ETH to a major exchange, a potential supply signal.",
    "relevance_score": 0.61,
    "sentiment": "negative",
    "tags": ["whale", "onchain", "eth"]
  }
]
